{
    "$schema": "https://json-schema.org/draft/2020-12/schema",
    "title": "PendingOrder",
    "description": "Resposta de GET /conversions/pending/<pedido> — resultado da pré-validação.",
    "type": "object",
    "required": ["status", "number", "fields"],
    "properties": {
        "status": {
            "type": "string",
            "enum": ["blocked", "warning", "ready"],
            "description": "blocked = não pode ir. warning = pode ir, com ressalva. ready = tudo certo"
        },
        "number": { "type": "string" },

        "reason": {
            "type": ["string", "null"],
            "enum": [
                "not_found", "already_sent", "ignored", "no_contact", "no_payment_date",
                "outside_window", "zero_total", "previously_denied", "partial_fields", null
            ]
        },
        "message": {
            "type": ["string", "null"],
            "description": "Texto pronto para exibir, já em português"
        },

        "customer_name": { "type": ["string", "null"] },
        "total":         { "type": ["number", "null"] },
        "payment_date":  { "type": ["string", "null"], "description": "formato DD/MM/YYYY" },
        "sent_at":       { "type": ["string", "null"], "description": "presente só quando reason == already_sent" },

        "fields": {
            "type": "array",
            "description": "Presença de cada campo usado no user_data da Meta — telefone e e-mail vêm primeiro",
            "items": { "$ref": "../schemas/shared.schema.json#/$defs/FieldStatus" }
        }
    }
}
