{
    "$schema": "./schema.json",
    "status": "ready",
    "number": "26512,1",
    "reason": null,
    "message": null,
    "customer_name": "Mariana Albuquerque",
    "total": 1946.89,
    "payment_date": "10/09/2026",
    "sent_at": null,
    "fields": [
        {
            "key": "phone",
            "present": true,
            "value": "11983596878"
        },
        {
            "key": "email",
            "present": true,
            "value": "mariana@email.com"
        },
        {
            "key": "name",
            "present": true,
            "value": "Mariana Albuquerque"
        },
        {
            "key": "zip",
            "present": true,
            "value": "01310100"
        },
        {
            "key": "city_state",
            "present": true,
            "value": "São Paulo - SP"
        }
    ]
}
